"title","type","director"
"Chhota Bheem - Neeli Pahaadi","Movie","Rajiv Chilaka"
"Chhota Bheem & Ganesh","Movie","Rajiv Chilaka"
"Chhota Bheem & Krishna: Mayanagari","Movie","Rajiv Chilaka"
"Chhota Bheem & Krishna: Pataliputra- City of the Dead","Movie","Rajiv Chilaka"
"Chhota Bheem And The Broken Amulet","Movie","Rajiv Chilaka"
"Chhota Bheem And The Crown of Valhalla","Movie","Rajiv Chilaka"
"Chhota Bheem and the Incan Adventure","Movie","Rajiv Chilaka"
"Chhota Bheem and The ShiNobi Secret","Movie","Rajiv Chilaka"
"Chhota Bheem Aur Hanuman","Movie","Rajiv Chilaka"
"Chhota Bheem aur Krishna","Movie","Rajiv Chilaka"
"Chhota Bheem aur Krishna vs Zimbara","Movie","Rajiv Chilaka"
"Chhota Bheem: Bheem vs Aliens","Movie","Rajiv Chilaka"
"Chhota Bheem: Dholakpur to Kathmandu","Movie","Rajiv Chilaka"
"Chhota Bheem: Dus Pe Dus","Movie","Rajiv Chilaka, Owll Mina"
"Chhota Bheem: Journey to Petra","Movie","Rajiv Chilaka"
"Chhota Bheem: Master of Shaolin","Movie","Rajiv Chilaka"
"Chhota Bheem: The Rise of Kirmada","Movie","Rajiv Chilaka"
"Chhota Bheem and the Curse of Damyaan","Movie","Rajiv Chilaka"
"Mighty Raju Rio Calling","Movie","Rajiv Chilaka, Anirban Majumder, Alka Amarkant Dubey"
"Bheemayan","Movie","Rajiv Chilaka"
"Chhota Bheem Kungfu Dhamaka","Movie","Rajiv Chilaka, Binayak Das"
"Dragonkala Ka Rahasya","Movie","Rajiv Chilaka"
